{
  "command": "career-ops-help",
  "schema_version": 1,
  "isolation": {
    "parallel": true,
    "summary": "JobGremlin runs in parallel and in isolation. It never changes Hermes, the cron job, the allowlist, ~/.local/bin or the current career-ops checkout.",
    "does_not_change": [
      "Hermes",
      "cron",
      "allowlist",
      "~/.local/bin",
      "current career-ops checkout"
    ],
    "writes": [
      "config/",
      "data/",
      "output/"
    ]
  },
  "commands": [
    {
      "name": "career-ops-run",
      "summary": "Apply to one explicit LinkedIn job or run the daily loop over a candidate queue.",
      "description": "Apply to one explicit LinkedIn job or to the first eligible job from a persistent candidate queue, record a session and return JSON. Success is reported only when LinkedIn confirms the application.",
      "usage": "usage: career-ops-run [-h] [--job JOB] [--candidates CANDIDATES]\n                      [--jd-dir JD_DIR] [--requeue-reason REQUEUE_REASON]\n                      [--target TARGET] [--max-seconds MAX_SECONDS]\n                      [--max-attempts MAX_ATTEMPTS]\n                      [--queue-low-watermark QUEUE_LOW_WATERMARK] [--cv CV]\n                      [--cv-min-score CV_MIN_SCORE] [--answers ANSWERS]\n                      [--run-id RUN_ID] [--video] [--adapter {real,fake}]\n                      [--fake-scenario {success,failure,wrong_cv,timeout,waiting_input,job_closed,daily_limit,lost_tab}]",
      "arguments": [],
      "options": [
        {
          "name": "--help",
          "names": [
            "-h",
            "--help"
          ],
          "dest": "help",
          "required": false,
          "type": "boolean",
          "action": "help",
          "default": null,
          "choices": null,
          "metavar": null,
          "help": "show this help message and exit"
        },
        {
          "name": "--job",
          "names": [
            "--job"
          ],
          "dest": "job",
          "required": false,
          "type": "string",
          "action": "store",
          "default": null,
          "choices": null,
          "metavar": null,
          "help": "LinkedIn job id to apply to (mutually exclusive with --candidates)"
        },
        {
          "name": "--candidates",
          "names": [
            "--candidates"
          ],
          "dest": "candidates",
          "required": false,
          "type": "string",
          "action": "store",
          "default": null,
          "choices": null,
          "metavar": null,
          "help": "JSON array/object or TSV list of candidates; the first eligible job is applied and the queue is persisted in data/queue.json"
        },
        {
          "name": "--jd-dir",
          "names": [
            "--jd-dir"
          ],
          "dest": "jd_dir",
          "required": false,
          "type": "string",
          "action": "store",
          "default": null,
          "choices": null,
          "metavar": null,
          "help": "read JD text files as <job-id>.txt from this directory instead of LinkedIn's guest endpoint (offline runs and tests)"
        },
        {
          "name": "--requeue-reason",
          "names": [
            "--requeue-reason"
          ],
          "dest": "requeue_reason",
          "required": false,
          "type": "string",
          "action": "store",
          "default": null,
          "choices": null,
          "metavar": null,
          "help": "explicitly allow blocked ids in --candidates mode to return to the queue; the reason is recorded in the queue history"
        },
        {
          "name": "--target",
          "names": [
            "--target"
          ],
          "dest": "target",
          "required": false,
          "type": "integer",
          "action": "store",
          "default": 1,
          "choices": null,
          "metavar": null,
          "help": "stop after this many verified applications in --candidates mode (default: 1; use 20 for the daily run)"
        },
        {
          "name": "--max-seconds",
          "names": [
            "--max-seconds"
          ],
          "dest": "max_seconds",
          "required": false,
          "type": "number",
          "action": "store",
          "default": null,
          "choices": null,
          "metavar": null,
          "help": "time budget for the whole --candidates run in seconds; 0 disables it (default: 4h or $CAREER_OPS_RUN_MAX_SECONDS)"
        },
        {
          "name": "--max-attempts",
          "names": [
            "--max-attempts"
          ],
          "dest": "max_attempts",
          "required": false,
          "type": "integer",
          "action": "store",
          "default": null,
          "choices": null,
          "metavar": null,
          "help": "attempts per job in one run (default: 2 or $CAREER_OPS_MAX_ATTEMPTS_PER_JOB)"
        },
        {
          "name": "--queue-low-watermark",
          "names": [
            "--queue-low-watermark"
          ],
          "dest": "queue_low_watermark",
          "required": false,
          "type": "integer",
          "action": "store",
          "default": null,
          "choices": null,
          "metavar": null,
          "help": "run discovery only when the backlog is at or below this number (default: 5 or $CAREER_OPS_QUEUE_LOW_WATERMARK)"
        },
        {
          "name": "--cv",
          "names": [
            "--cv"
          ],
          "dest": "cv",
          "required": false,
          "type": "string",
          "action": "store",
          "default": null,
          "choices": null,
          "metavar": null,
          "help": "PDF to attach, bypassing the CV cache (default: $CAREER_OPS_CV; in --candidates mode without it the cache generates or reuses one)"
        },
        {
          "name": "--cv-min-score",
          "names": [
            "--cv-min-score"
          ],
          "dest": "cv_min_score",
          "required": false,
          "type": "number",
          "action": "store",
          "default": null,
          "choices": null,
          "metavar": null,
          "help": "override the CV reuse threshold (0-1; default: 0.90 from config/cv-cache.json or $CAREER_OPS_CV_MIN_SCORE)"
        },
        {
          "name": "--answers",
          "names": [
            "--answers"
          ],
          "dest": "answers",
          "required": false,
          "type": "string",
          "action": "store",
          "default": null,
          "choices": null,
          "metavar": null,
          "help": "answers JSON (default: $CAREER_OPS_ANSWERS, then the workspace or upstream config/answers-hermes.json)"
        },
        {
          "name": "--run-id",
          "names": [
            "--run-id"
          ],
          "dest": "run_id",
          "required": false,
          "type": "string",
          "action": "store",
          "default": null,
          "choices": null,
          "metavar": null,
          "help": "session directory name under output/sessions/ (default: UTC timestamp)"
        },
        {
          "name": "--video",
          "names": [
            "--video"
          ],
          "dest": "video",
          "required": false,
          "type": "boolean",
          "action": "store_true",
          "default": false,
          "choices": null,
          "metavar": null,
          "help": "record one MP4 per daily run in output/sessions/<run_id>/video.mp4 (default: off or $CAREER_OPS_VIDEO)"
        },
        {
          "name": "--adapter",
          "names": [
            "--adapter"
          ],
          "dest": "adapter",
          "required": false,
          "type": "string",
          "action": "store",
          "default": "real",
          "choices": [
            "real",
            "fake"
          ],
          "metavar": null,
          "help": "browser implementation; use fake for tests and demos (default: real)"
        },
        {
          "name": "--fake-scenario",
          "names": [
            "--fake-scenario"
          ],
          "dest": "fake_scenario",
          "required": false,
          "type": "string",
          "action": "store",
          "default": "success",
          "choices": [
            "success",
            "failure",
            "wrong_cv",
            "timeout",
            "waiting_input",
            "job_closed",
            "daily_limit",
            "lost_tab"
          ],
          "metavar": null,
          "help": "outcome produced by --adapter fake (default: success)"
        }
      ],
      "examples": [
        "career-ops-run --job 4411222 --cv output/cv-renan-react.pdf",
        "career-ops-run --job 4411222 --cv output/cv-renan-react.pdf --adapter fake",
        "career-ops-run --candidates data/candidates.json --cv output/cv-renan-react.pdf",
        "career-ops-run --candidates data/candidates.json --jd-dir data/jd-fixtures \\\n    --adapter fake --run-id queue-demo",
        "career-ops-run --candidates data/candidates.json --jd-dir data/jd-fixtures \\\n    --adapter fake --target 20 --max-seconds 14400 --run-id daily-2026-10-20",
        "career-ops-run --candidates data/candidates.json --requeue-reason \"jd now available\"",
        "career-ops-run --help"
      ],
      "exit_codes": [
        {
          "code": 0,
          "meaning": "LinkedIn confirmed the application (the verified target was reached)"
        },
        {
          "code": 1,
          "meaning": "the target was not reached (queue exhausted, time budget, daily limit or the last application failed), including when no candidate was eligible"
        },
        {
          "code": 2,
          "meaning": "invalid command-line arguments or an invalid candidate file"
        },
        {
          "code": 3,
          "meaning": "missing CV/answers/candidates/JD source, invalid configuration or another run holding data/run.lock"
        },
        {
          "code": 6,